Title,Price,Sales,URL,Image
"60 Inch/152cm Camera Tripod with Travel Bag, Mobile Phone Tripod with Remote Control, Professional Aluminum Alloy Portable Stand",56867.0,477,https://www.aliexpress.com/item/1005010271862772.html,//ae-pic-a1.aliexpress-media.com/kf/Sbc6f800520c5447b9641fbcd8ffccd2br.jpg_480x480q75.jpg_.avif
"Mini Tripod for Camera, 25inch Aluminum Tabletop Camera Tripod, Portable Travel Tripod , for Cameras, Projectors, Spotting Scope",55651.0,500,https://www.aliexpress.com/item/1005008941772024.html,//ae-pic-a1.aliexpress-media.com/kf/Sb157b62f50b0433284a50e94ed66e9ebn.jpg_480x480q75.jpg_.avif
Tripods For Phone Lightweight Camera Tripod Stand with Bluetooth Selfie Remote Phone Holder Video Photography For iPhone Xiaomi,27372.0,411,https://www.aliexpress.com/item/1005010642374765.html,//ae-pic-a1.aliexpress-media.com/kf/S164b872c4bc74dbdbc9c8f6bacfc3f81J.jpg_480x480q75.jpg_.avif
Selfie Stick 1.7 Meter Ultra Long Stretch Portable debounce Phone Holder Bluetooth Remote With Fill light Tripod Stand For Live,32775.0,426,https://www.aliexpress.com/item/1005010471228173.html,//ae-pic-a1.aliexpress-media.com/kf/S89d00cdb84204ea5b60d1ff1d47a689eG.png_480x480.png_.avif
"Portable selfie stick tripod, adjustable beauty fill light Bluetooth remote control for iPhone Samsung phone",18530.0,115,https://www.aliexpress.com/item/1005009568772348.html,//ae-pic-a1.aliexpress-media.com/kf/S5b91277c7e4d497ba0efa3836c2eeea8D.jpg_480x480q75.jpg_.avif
"Camera Tripod, 74"" DSLR Camera Tripod with 1 QR Plates for Sony/Nikon/Canon, Lightweight Video Tripod Stand",110572.0,600,https://www.aliexpress.com/item/1005008072398718.html,//ae-pic-a1.aliexpress-media.com/kf/S2bfc42d0ad934bb3bf25b941ad54868f7.jpg_480x480q75.jpg_.avif
"F16 Selfie Stick Tripod with 1708mm Long 8-Section Pole, Bluetooth Remote, 360° Rotation, 1/4 Interface, for Phone Camera Vlog",33258.0,12,https://www.aliexpress.com/item/1005009935503349.html,//ae-pic-a1.aliexpress-media.com/kf/Se0537c3406b845cc88c311f9d40931caK.jpg_480x480q75.jpg_.avif
T18 Magnetic Phone Tripod Wireless Phone Grip Selfie Stick Desktop Tripod,34340.0,258,https://www.aliexpress.com/item/1005010644966613.html,//ae-pic-a1.aliexpress-media.com/kf/S25b129f844f543f69464f5dea270cc71S.png_480x480.png_.avif
"Tripod for Camera, Camera Tripod 60"" Heavy Duty Tripod, Phone Tripod for Video Recording Photo Vlog, Iron Camera Tripods",100549.0,85,https://www.aliexpress.com/item/1005008109029486.html,//ae-pic-a1.aliexpress-media.com/kf/S34291515f3fe419f8e7b97912657b623Y.jpg_480x480q75.jpg_.avif
Ulanzi MT44B 1.5M 2-in-1 Selfie Stick Tripod Stand Remote Control Phone Tripod for Iphone 17 16 Android Camera DSLR Vlog Live,32623.0,51,https://www.aliexpress.com/item/1005010636241731.html,//ae-pic-a1.aliexpress-media.com/kf/S0260e10995694f48a642c9b1a6f56e5di.jpg_480x480q75.jpg_.avif
"Auto Pop-Up Tripod Portable 70-Inch All-in-one Selfie Stick, Foldable Phone Holder with Bluetooth Remote for iPhone Android",46917.0,173,https://www.aliexpress.com/item/1005009226760525.html,//ae-pic-a1.aliexpress-media.com/kf/S28631223f24d4a52a35f95e71add28d2V.jpg_480x480q75.jpg_.avif
Mobile live streaming stand tripod aluminum alloy tube 1.6m selfie stick Bluetooth remote control,29939.0,10,https://www.aliexpress.com/item/1005008229076599.html,//ae-pic-a1.aliexpress-media.com/kf/Sefdad18c36b942f597093d1c00376204M.jpg_480x480q75.jpg_.avif
"Selfie Stick Tripod For DJI Action 5 Pro 4/Osmo 360/Pocket 3/Insta360 Ace Pro 2,Camera Live Streaming Photography Accessories",17209.0,500,https://www.aliexpress.com/item/1005008722962388.html,//ae-pic-a1.aliexpress-media.com/kf/Sca5022550cac46b3bc3a348b665e7013g.jpg_480x480q75.jpg_.avif
Manbily V-Yoke Lightweight Monopod For Hunting Shooting Sticks Rifle Tactical Tripods Telescope Accessories with Shoulder Strap,37805.0,44,https://www.aliexpress.com/item/1005004836518761.html,//ae-pic-a1.aliexpress-media.com/kf/S6d9a4ab6054d46fca944a2f97c7d7e5cF.jpg_480x480q75.jpg_.avif
Portable Tripod For Phone Lightweight Camera Tripod Stand with Bluetooth Selfie Remote Phone Holder For Phone Video Photography,27636.0,23,https://www.aliexpress.com/item/1005010649509226.html,//ae-pic-a1.aliexpress-media.com/kf/Sf0f83d17d61b4e00b06d001e93178290N.jpg_480x480q75.jpg_.avif
"Tripod Stand Floor Projector Stand with 1/4"" Threaded Adjustable Telescopic Rod 55CM/170CM Floor Stand Tripod",21614.0,46,https://www.aliexpress.com/item/1005010776702741.html,//ae-pic-a1.aliexpress-media.com/kf/S871bc94f53a14176b7f4e6b2ff915b846.jpg_480x480q75.jpg_.avif
"1.55m Extendable Wireless Selfie Stick Tripod with Bluetooth Remote for iPhone Android GoPro,360°Rotation Phone Stand for Videos",46377.0,88,https://www.aliexpress.com/item/1005009425048314.html,//ae-pic-a1.aliexpress-media.com/kf/S19b603dca4ab4b6fb037faabb6e4af160.jpg_480x480q75.jpg_.avif
Flymile Tripod Selfie Stick Vlog Handle for DJI Pocket 3/Action 5 Pro/Insta360 X5/Gopro Accessories 62.99/55.1in Extendable,35763.0,223,https://www.aliexpress.com/item/1005009630445693.html,//ae-pic-a1.aliexpress-media.com/kf/S06e687e79ec6425d8c2f4cd43dfd3abc1.jpg_480x480q75.jpg_.avif
360°Rotatable Selfie Stick Tripod Rechargeable Smart Face Tracking Tripod with 2 Fill Light Phone Holder for Live Streaming Vlog,83639.0,279,https://www.aliexpress.com/item/1005010623895366.html,//ae-pic-a1.aliexpress-media.com/kf/Sb410d9cbb7984746a50a68ee8c59b6d7s.jpg_480x480q75.jpg_.avif
"20/50/160/200cm Aluminum Tripod Stand, 1/4'' Mount for Phone Camera Light Projector - Portable Multiuse",11501.0,114,https://www.aliexpress.com/item/1005008918043771.html,//ae-pic-a1.aliexpress-media.com/kf/S9ee6dfe9bf714fb4afdb2f8408621628h.png_480x480.png_.avif
160cm Live Broadcast Photo Tripod Landing Type Camera Anchor Video Selfie Light Frame Metal Mobile Phone Holder,38998.0,336,https://www.aliexpress.com/item/1005009788229853.html,//ae-pic-a1.aliexpress-media.com/kf/S679269450d614ac49df8650c2b0988b6o.jpg_480x480q75.jpg_.avif
180cm Selfie Stabilizer Wireless Selfie Stick Tripod Stand Foldable Monopod For Phone Action Camera Balance Steady Shooting,14580.0,17,https://www.aliexpress.com/item/1005009542050869.html,//ae-pic-a1.aliexpress-media.com/kf/S3129df86b06a4f3caac0c2789e511db3R.jpg_480x480q75.jpg_.avif
Ulanzi MT-78 Quick-Release Tripod with Cold Shoe Mount 1.85M Height for Selfie Vlogging Live Photograph with Flexible Ball Head,38450.0,800,https://www.aliexpress.com/item/1005007467875784.html,//ae-pic-a1.aliexpress-media.com/kf/S339e252bc91643809e632745fbda6b3bZ.jpg_480x480q75.jpg_.avif
Mini Extendable Desktop Tripod Handle Grip Stand With Flexible Ballhead 1/4 Inch Screw Extend Mount For Camera GoPro Insta360 X4,17918.0,64,https://www.aliexpress.com/item/1005010650734546.html,//ae-pic-a1.aliexpress-media.com/kf/S7f94b91a7ceb44cf9ddb56fbfa814eb7y.jpg_480x480q75.jpg_.avif
"Mini Phone Tripod,Travel Tripod,Portable and Adjustable Holder with Universal Clip, Compatible with Cellphones,Phone Tripod Stan",11287.0,16,https://www.aliexpress.com/item/1005009929881701.html,//ae-pic-a1.aliexpress-media.com/kf/S8363ac8fc60e451d9c8821b719e1c94f7.jpg_480x480q75.jpg_.avif
Flymile Selfie Stick Tripod for DJI Action 6/Action 5 Pro/Insta360 Ace Pro 2/GoPro Camera Extendable Selfie Vlog Accessories,20815.0,247,https://www.aliexpress.com/item/1005009136857212.html,//ae-pic-a1.aliexpress-media.com/kf/S6b9dfa4cf83445ea81ca7f2eb4ed2e78s.jpg_480x480q75.jpg_.avif
Selfie Stick 1.1 m Ultra Long Stretch Portable Phone Holder Integrated Design Bluetooth Remote With Fill light Tripod Stand For,33356.0,21,https://www.aliexpress.com/item/1005010008916198.html,//ae-pic-a1.aliexpress-media.com/kf/Sb3eb25821f3a425f923114a68f070cdcl.png_480x480.png_.avif
"MT-08 Foldable Tripods For Phone Cold Shoe Ball Head 1/4'' Selfie Stick Mini Holder Bracket For Camera DSLR, Action Camera GoPro",17915.0,106,https://www.aliexpress.com/item/1005010649152928.html,//ae-pic-a1.aliexpress-media.com/kf/S3cd2f174b2c74717954fe1c02d5d6ac3I.jpg_480x480q75.jpg_.avif
3 in 1 Mini Selfie Stick Tripod Aluminum Monopod Phone Stand For Xiaomi Mi Redmi Note 9 Huawei iPhone 11 Pro Samsung Smartphone,33484.0,19,https://www.aliexpress.com/item/1005001425716860.html,//ae-pic-a1.aliexpress-media.com/kf/Hc80c771a5f60483c8e86d7fa83235347F.jpg_480x480q75.jpg_.avif
Ulanzi TT88 Overhead Selfie Stick 1.44M with MagSafe Clamp Photograph Tripod 360° Panoramic Shooting for Phone Livestream Vlog,29843.0,900,https://www.aliexpress.com/item/1005008125590318.html,//ae-pic-a1.aliexpress-media.com/kf/S80cae3597b0d456aa2883e6f1ea2cff4O.jpg_480x480q75.jpg_.avif
"MT-08 Desktop Extendable Desktop Tripods Handheld Photography Bracket Stand with Flexible Ballhead 1/4"" Screw Mount For Selfie",18025.0,235,https://www.aliexpress.com/item/1005010648876449.html,//ae-pic-a1.aliexpress-media.com/kf/Se30fadee80be48f687b36d0b72e01608G.jpg_480x480q75.jpg_.avif
Foldable Magnetic Phone Tripod Stand With Hook Design Arca+Cold Shoe Aluminum Selfie Stick Tripod for iPhone/Android Travel,33085.0,14,https://www.aliexpress.com/item/1005010797933706.html,//ae-pic-a1.aliexpress-media.com/kf/S154c99d1882d44a0bec49540e45b3478f.jpg_480x480q75.jpg_.avif
"1PC Selfie Stick Wireless Selfie Stick With Tripod Stand Selfie Stick , Remote Control, Phone Holder And Built-In Tripod",15665.0,73,https://www.aliexpress.com/item/1005011741966075.html,//ae-pic-a1.aliexpress-media.com/kf/Safd1a39c84e849a091cddba698ca7eb4n.jpg_480x480q75.jpg_.avif
45cm Lightweight Camera Tripod For Mobile Tripod Camera Portable SLR Bluetooth-compatible Desktop Cam Stand Monopod Smartphone,43178.0,10,https://www.aliexpress.com/item/1005009962425516.html,//ae-pic-a1.aliexpress-media.com/kf/Sdb205d8d38e242a79deffb3449ef6368u.jpg_480x480q75.jpg_.avif
Video Camera Tripod Stand for Phone Professional Xiaomi HUAWEI iPhone Gopro Selfie Remote Control Extendable Photography,43506.0,32,https://www.aliexpress.com/item/1005009008904870.html,//ae-pic-a1.aliexpress-media.com/kf/S985af33ba8f94742a158fc49d56357c8k.jpg_480x480q75.jpg_.avif
Extension Tripod Selfie Stick Tripod Stand Desktop Tripod Handheld Photography Stand For GoPro Insta360 DJI Action Pocket Camera,17969.0,39,https://www.aliexpress.com/item/1005010652752123.html,//ae-pic-a1.aliexpress-media.com/kf/S6c4dec1b68b243dfbb09d017c0e169b7M.jpg_480x480q75.jpg_.avif
"AXNEN Mobile Phone Tripod C12/C13 Tipods for Cellphone Gopro Action Camera, 1325mm Stand with Wireless Bluetooth Remote for Live",31215.0,700,https://www.aliexpress.com/item/1005007809283485.html,//ae-pic-a1.aliexpress-media.com/kf/Sea4250ee1e9c4b0a8b992f96c9cf4c2fY.jpg_480x480q75.jpg_.avif
Ulanzi MT85 Automatic Phone Tripod Magsafe Dual-Side Magnet with 10m Wireless Control for Outdoor Travel Selfie Stick Livestream,35827.0,600,https://www.aliexpress.com/item/1005010150732572.html,//ae-pic-a1.aliexpress-media.com/kf/S24a244c5ae9a4130a6e3612e89d593a3B.png_480x480.png_.avif
Ulanzi MT-16 Foldable Tripod for Phone Cold Shoe Ball Head 1/4'' Selfie Stick Mini Holder Bracket for Mobile Camera DSLR,20153.0,377,https://www.aliexpress.com/item/1005005004047315.html,//ae-pic-a1.aliexpress-media.com/kf/S9c97e4165e27489e9298738e889e2c0eD.jpg_480x480q75.jpg_.avif
1800mm TT01 Tripod Auto Pop Open Stand Bounce Selfie Stick Phone Holder with Magnetic Remote Control for Vlog Video Shooting,50173.0,335,https://www.aliexpress.com/item/1005008963947535.html,//ae-pic-a1.aliexpress-media.com/kf/S775fe7948bd44025b7d6a3ccf3dde299x.jpg_480x480q75.jpg_.avif
Selfie Stick Tripod for Instar360 X5/DJI Action 5 Pro/Pocket 3/Gopro 13/DSlR Camera Extension Pole Travel Vlgo Video Live Holder,29179.0,43,https://www.aliexpress.com/item/1005006718095037.html,//ae-pic-a1.aliexpress-media.com/kf/Sabdb9ac5ea17459798b15649543e11b7t.jpg_480x480q75.jpg_.avif
